{
  "$schema": "http://json-schema.org/draft-07/schema#",
  "title": "Unit catalog entry (docs/design/units/units/<id>/unit.json)",
  "description": "Documents the format; catalog.py validates against the same rules. Empty values are omitted when saving. Lengths in metres.",
  "type": "object",
  "required": ["id", "real_name", "class", "mobility", "status"],
  "properties": {
    "id": {"type": "string", "pattern": "^[a-z0-9_]{2,48}$"},
    "real_name": {"type": "string", "minLength": 1},
    "variant_note": {"type": "string"},
    "class": {"type": "string", "description": "id from classes.json"},
    "mobility": {"enum": ["tracked", "wheeled", "foot"]},
    "operators": {"type": "array", "items": {"type": "string", "description": "faction id from factions/"}},
    "in_service": {"type": "string"},
    "country_of_origin": {"type": "string"},
    "crew": {"type": ["string", "number"]},
    "weight_t": {"type": "number", "minimum": 0},
    "armament": {
      "type": "object",
      "properties": {"main": {"type": "string"}, "secondary": {"type": "string"}},
      "additionalProperties": false
    },
    "protection": {"type": "string"},
    "speed_road_kmh": {"type": "number", "minimum": 0},
    "speed_offroad_kmh": {"type": "number", "minimum": 0},
    "range_km": {"type": "number", "minimum": 0},
    "fire_range_km": {"type": "number", "minimum": 0},
    "notes": {"type": "string"},
    "dimensions": {
      "type": "object",
      "properties": {
        "hull_length": {"type": "number", "minimum": 0},
        "overall_length": {"type": "number", "minimum": 0},
        "width": {"type": "number", "minimum": 0},
        "height": {"type": "number", "minimum": 0},
        "sources": {"type": "array", "items": {"type": "string"}}
      },
      "additionalProperties": false
    },
    "silhouette_features": {"type": "array", "items": {"type": "string"}, "description": "most recognisable first"},
    "details": {"type": "array", "items": {"type": "string"}},
    "skip": {"type": "array", "items": {"type": "string"}},
    "camo_note": {"type": "string"},
    "mechanisms": {
      "type": "object",
      "description": "how the real vehicle animates: mechanism id (docs/design/units/mechanisms.json) -> its parameters. Authoritative for this unit; classes.json only suggests defaults. Missing parameters are filled with the registry default on save (provenance source 'default'). Keys are written in registry order.",
      "additionalProperties": {
        "type": "object",
        "description": "parameter name -> value; the allowed names and values come from the registry: number (min/max), enum (values) or angle_range ([lo, hi] with min <= lo <= 0 <= hi <= max and lo < hi, or \"full\" when allowed)",
        "additionalProperties": {"type": ["number", "string", "array"]}
      }
    },
    "images": {
      "type": "array",
      "items": {
        "type": "object",
        "required": ["file", "view"],
        "properties": {
          "file": {"type": "string", "pattern": "^(side|front|rear|top|three_quarter|detail|drawing)_[0-9]+\\.(jpg|png|webp)$"},
          "view": {"enum": ["side", "front", "rear", "top", "three_quarter", "detail", "drawing"]},
          "source_url": {"type": "string"},
          "license": {"type": "string"},
          "note": {"type": "string"}
        },
        "additionalProperties": false
      }
    },
    "image_candidates": {
      "type": "array",
      "description": "images proposed by AI research (/research-unit), not downloaded yet; the human downloads or dismisses them",
      "items": {
        "type": "object",
        "required": ["url", "view"],
        "properties": {
          "url": {"type": "string", "pattern": "^https://"},
          "view": {"enum": ["side", "front", "rear", "top", "three_quarter", "detail", "drawing"]},
          "license": {"type": "string"},
          "source_page": {"type": "string"},
          "note": {"type": "string"}
        },
        "additionalProperties": false
      }
    },
    "provenance": {
      "type": "object",
      "description": "per researchable field (dotted path, e.g. dimensions.height; also mechanisms.<id> and mechanisms.<id>.<param> as allowed by the registry): where an AI value came from, whether the human verified it, and a different value the AI found for a field the human had filled",
      "additionalProperties": {
        "type": "object",
        "properties": {"source": {"type": "string"}, "verified": {"type": "boolean"}, "suggested": {}},
        "additionalProperties": false
      }
    },
    "status": {"enum": ["draft", "ready_for_model", "modeled", "in_game"]},
    "feedback": {"type": "string", "description": "the human's remarks on the latest render, read by the modeler"},
    "updated": {"type": "string", "description": "ISO date of the last save"},
    "revision": {"type": "integer", "minimum": 0, "description": "incremented by the tool on every content change; used to detect concurrent edits (409)"}
  },
  "additionalProperties": false,
  "$defs": {
    "classes_json_entry": {
      "$comment": "Not referenced by the unit schema; documents the format of docs/design/units/classes.json.",
      "description": "One entry of docs/design/units/classes.json",
      "type": "object",
      "required": ["id", "label", "mobility"],
      "properties": {
        "id": {"type": "string", "pattern": "^[a-z0-9_]{2,48}$"},
        "label": {"type": "string"},
        "mobility": {"enum": ["tracked", "wheeled", "foot"]},
        "required_views": {"type": "array", "items": {"enum": ["side", "front", "rear", "top", "three_quarter", "detail", "drawing"]}},
        "default_mechanisms": {"type": "array", "items": {"type": "string"}, "description": "mechanism ids from mechanisms.json pre-filled (with default parameters, provenance 'class default') when a unit of this class is created; only a suggestion, the unit entry is authoritative"}
      }
    }
  },
  "$comment": "ready_for_model additionally requires: real_name, class, operators (>=1), dimensions.height/width/hull_length > 0, >=3 silhouette_features, >=1 side or drawing image, and no unverified AI value (provenance verified=false) in dimensions.hull_length/width/height or silhouette_features; a non-empty mechanisms object; and no unverified value (provenance verified=false, whether AI, default or class default) under mechanisms."
}
